{
    "cap1": "Design of a hotel or chalet on the cloud, in the style of light pink, serene oceanic vistas, snailcore, playful machines, 32k UHD, made of rubber, tender depiction of nature",
    "cap2": "Robotic eagle, 8k unreal engine render, wires and gears, photorealistic",
    "cap3": "detailed pen and ink illustration of Boracay Island, by Herge, in the style of tin-tin comics, vibrant colors, detailed, sunny day",
    "cap4": "detailed pen and ink illustration of Boracay Island, by Herge, in the style of tin-tin comics, vibrant colors, detailed, sunny day",
    "neg_cap": "low quality",
    "resolution": "2048x1024 (4x1 Grids)",
    "num_sampling_steps": 30,
    "cfg_scale": 4,
    "solver": "midpoint",
    "t_shift": 4,
    "seed": 0,
    "scaling_method": "Time-aware",
    "scaling_watershed": 0.3,
    "proportional_attn": true,
    "width_2048": 2048,
    "width_2560": 2560,
    "width_3072": 3072,
    "width_1024": 1024,
    "width_1536": 1536,
    "height_2048": 2048,
    "height_2560": 2560,
    "height_3072": 3072,
    "height_1024": 1024,
    "height_1536": 1536
}